RNG Hexa,RNG Index,Frame 1,Frame 2,Frame 3,Frame 4,Frame 5,Frame 6,Frame 7,Frame 8,Frame 9,Frame 10
00000001,000,M2 (Snake3) C6 (Q5) F9 (Elastoid4) T1 (Jelleye8) G7,(Malboro7) F6 (Q5) M9 (Snake4) T8 (Mask3) G2 (Mantis1),(Biggs7) F3 (Q6) T5 (Elnoyle8) M9 (Jelleye2) C4 (Snake1),XX,XX,XX,(Q7) M4 (Robot1) G5 (Mantis8) C9 (Glacial6) T2 (Grat3),XX,(Q4) F5 (Biggs6) M8 (Jelleye9) T7 (Grendel1) G2 (Buel3),XX
00000000,999,Q2 () Q6 () Q9 () Q1 () Q7,(Q7) Q6 (Q5) Q9 (Q4) Q8 (Q3) Q2 (Q1),(Q7) Q3 (Q6) Q5 (Q8) Q9 (Q2) Q4 (Q1),XX,XX,XX,XX,XX,XX,XX
d5343fb9,200,B1 (Beast2) F4 (Jelleye5) T7 (Q6) C3 (Chimera8) I9,(Q4) F3 (Beast6) B9 (Robot8) T7 (Chimera5) I2 (Creeps1),(Jelleye9) B1 (Robot4) I7 (Unicorn2) F5 (Buel6) T8 (Q3),(Elnoyle9) F5 (Chimera8) B6 (Q2) I3 (Ruby4) T7 (Buel1),(Biggs9) F1 (Glacial2) B4 (Q5) T7 (Grat6) C3 (Mask8),(Elnoyle9) F1 (Q2) B4 (Beast5) T7 (Grendel6) I8 (Mask3),B1 (Glacial2) F4 (Elastoid5) T7 (Buel6) I3 (Q9) C8,(Elastoid9) F5 (Q2) T1 (King4) I7 (Malboro6) C8 (Snake3),(Elnoyle9) C2 (Malboro1) B4 (Q5) T7 (Grendel6) F3 (Glacial8),F1 (Giant4) B2 (Grat5) I7 (Creeps6) C3 (King8) T9
a1cc6c26,201,B3 (Grendel2) F6 (Q5) I9 (Snake4) T1 (Chimera7) C8,B1 (Mask4) F2 (Unicorn5) C3 (Robot6) T7 (Q8) I9,T3 (Beast6) B9 (Q8) C2 (Robot1) F5 (Elastoid7) I4,F1 (Malboro4) B2 (Robot5) C3 (Elnoyle6) T7 (Q9) I8,F6 (King3) T2 (Biggs5) B9 (Q8) I7 (Jelleye1) C4,F3 (Beast2) C6 (Q5) B9 (Elastoid7) I4 (Ruby1) T8,B1 (Mask2) F4 (Creeps5) T7 (Q6) C3 (Bird8) I9,T3 (Elastoid6) C2 (Q1) B5 (Elnoyle4) F8 (Jelleye9) I7,(Biggs9) F6 (Q5) T4 (Chimera7) I8 (Jelleye3) C1 (Grat2),F1 (Q4) B2 (Mask5) C3 (Bird6) T7 (Mantis8) I9
5e56886f,202,B3 (Robot2) C6 (Q5) F9 (Grat7) T8 (Mantis4) I1,(Elastoid9) C1 (Mask2) B4 (Q5) T7 (Buel8) I6 (Creeps3),(Elnoyle9) C1 (Ruby2) B4 (Glacial5) T7 (Mantis6) F8 (Q3),(Elnoyle9) C6 (Q5) T4 (Snake7) B8 (Robot3) I2 (Giant1),(Elastoid9) F1 (Jelleye4) T7 (Grat6) B2 (Grendel5) C3 (Q8),(Elnoyle9) C2 (Biggs3) I6 (Q1) F5 (Robot4) B8 (Grat7),(Q7) F1 (Grat4) B2 (Mantis5) C3 (King8) I9 (Grendel6),(Q4) T7 (Robot8) B9 (Giant5) I6 (Malboro1) C3 (Glacial2),(Elnoyle9) B1 (Beast2) F4 (Q5) T7 (Buel6) I3 (Creeps8),(Biggs9) F1 (Mantis2) B4 (Q5) T7 (Snake6) C3 (Unicorn8)
78a7e3e4,203,(Biggs9) C1 (Q4) F2 (Beast5) I8 (Glacial3) B6 (Grendel7),(Mantis9) F1 (Q2) B4 (Ruby5) T7 (Grat8) C6 (Bird3),(Giant9) F1 (Q2) B4 (Unicorn5) T7 (Ruby8) I6 (Mask3),(Elnoyle9) F3 (Q6) T5 (Biggs8) I2 (Creeps4) B7 (Beast1),F3 (Biggs6) T2 (Beast5) I9 (Q8) C1 (Glacial7) B4,(Elastoid9) F1 (Elnoyle2) B4 (Q5) T7 (Grendel6) I3 (Chimera8),(Mask7) C4 (Ruby5) F6 (Glacial9) T8 (Q2) I1 (Malboro3),(Biggs9) B1 (Q4) F2 (Elnoyle5) C3 (King6) I8 (Mask7),(Robot6) F1 (Q2) B4 (Giant5) T7 (Glacial3) I8 (Bird9),(Bird9) F1 (King2) B4 (Q5) T7 (Snake6) I8 (Chimera3)
08e81195,204,F1 (Robot4) B2 (Buel5) T7 (Unicorn6) C3 (Giant9) I8,C1 (Chimera2) B4 (Q5) T7 (Mask9) F8 (King6) I3,(Beast8) F1 (Q2) B4 (Glacial5) T7 (Creeps9) C6 (Buel3),(Bird7) F1 (Q4) C2 (Snake8) B9 (Grat5) I6 (Jelleye3),F1 (Elastoid2) T4 (Jelleye5) I7 (Creeps9) B8 (Q3) C6,(Bird8) F1 (Q4) B2 (Ruby5) I7 (Grat9) C6 (Buel3),(Robot7) C1 (Q4) F2 (Buel5) I8 (Mask6) B3 (Malboro9),F1 (Q4) B2 (Elnoyle5) C3 (Unicorn6) T7 (Ruby9) I8,(Elnoyle9) C1 (Biggs4) T7 (Q2) B8 (Giant6) I5 (Unicorn3),(Elastoid9) C1 (Chimera2) F4 (Glacial5) I7 (Q6) B8 (Elnoyle3)
fc4fa552,205,C1 (Ruby4) F2 (Q5) B3 (Biggs6) I7 (Chimera9) T8,(Q4) F1 (Robot5) T2 (Jelleye3) C6 (Snake9) I8 (Bird7),C1 (Jelleye2) B4 (Q5) F3 (Biggs6) T7 (Glacial9) I8,F1 (Elastoid2) B4 (Q5) T7 (Grat8) I9 (Robot3) C6,C1 (Mask2) B4 (Bird5) T7 (Grat6) F3 (Q8) I9,B1 (Q2) F4 (Robot5) T7 (Malboro8) I9 (Grendel3) C6,F1 (Buel2) B4 (Creeps5) T7 (Grat8) C6 (Q9) I3,F1 (Q4) B2 (Malboro5) C3 (Mantis6) T7 (Mask9) I8,C1 (Q4) F2 (Beast5) B3 (Elnoyle6) T7 (Buel8) I9,(Q3) T2 (Beast5) B8 (Jelleye9) C6 (King7) F4 (Malboro1)
bc7e8cab,206,F1 (Elnoyle2) B4 (Buel5) T7 (Q6) C3 (Grat8) I9,C1 (Beast2) B4 (Q5) T7 (Grendel6) F3 (Glacial9) I8,B2 (Snake3) F6 (Q5) I9 (Chimera4) T1 (Jelleye8) C7,(Biggs9) F1 (Buel4) B2 (Elnoyle5) T7 (Ruby6) C3 (Q8),(Q7) B1 (Giant2) T4 (Mantis3) I8 (Ruby9) C5 (Grat6),F1 (Chimera2) B4 (Giant5) T7 (Q6) C3 (Ruby8) I9,F3 (Chimera2) B6 (Q5) I9 (Biggs7) C8 (Robot4) T1,(Biggs9) C6 (Q5) T4 (Ruby7) F8 (Unicorn3) I2 (Glacial1),F1 (Elnoyle2) B4 (Elastoid5) T7 (King6) C3 (Q9) I8,(Giant9) C1 (Q4) F2 (Glacial3) B5 (Jelleye6) I8 (Beast7)
eb2653f0,207,C1 (Ruby4) F2 (Beast5) B3 (Mantis6) T7 (Q8) I9,B3 (Q6) T5 (Jelleye8) F9 (Robot4) C2 (Elastoid7) I1,F1 (Ruby2) B4 (Mask5) C3 (Elastoid6) T7 (Q8) I9,F1 (Mantis2) B4 (Giant5) C7 (Q3) T8 (Malboro9) I6,C3 (Mask2) B6 (Q5) F9 (Elastoid7) I4 (Jelleye1) T8,F1 (Creeps2) B4 (Mantis5) T7 (Q6) I3 (Grendel9) C8,(Elnoyle9) F2 (Q1) T6 (Giant5) C3 (Robot4) I8 (Grat7),F3 (Mantis6) T2 (Mask5) C1 (Robot4) B9 (Jelleye8) I7,B3 (Elnoyle2) F6 (Q5) T4 (Robot7) C1 (Ruby8) I9,(Biggs9) F1 (Q2) B4 (Malboro7) I8 (Creeps3) C5 (Grat6)
93e46731,208,(Elnoyle9) C1 (Ruby4) F2 (Unicorn5) I7 (Q3) B8 (Malboro6),(Biggs9) C1 (Elnoyle2) F4 (Grendel5) T7 (Q6) B8 (Giant3),(Elnoyle9) C1 (Chimera2) B4 (Glacial5) T7 (Unicorn6) F8 (Q3),(Biggs9) C1 (Elnoyle2) B4 (Robot5) T7 (Q8) I6 (Bird3),(Q3) T1 (Jelleye2) F4 (Ruby5) I7 (Glacial9) C6 (Mantis8),XX,XX,XX,XX,XX
6e551f3e,209,B1 (Bird2) F4 (Q5) T7 (Elastoid8) C9 (Glacial6) I3,F1 (Bird4) B2 (Q5) T7 (Ruby9) I8 (Robot3) C6,F1 (Q4) B2 (Malboro5) T7 (Grat6) C3 (Giant8) I9,C3 (Grendel2) F6 (Malboro5) T1 (Elastoid4) B8 (Q7) I9,F1 (Elnoyle2) T4 (Beast5) C7 (Q8) B9 (Creeps6) I3,B1 (Q2) F4 (Elastoid5) C6 (Grat9) I3 (Malboro8) T7,F1 (Q4) B2 (Beast5) T7 (Malboro6) C3 (Mantis9) I8,F1 (Q4) B2 (King5) T7 (Snake8) C3 (Creeps6) I9,C1 (Giant2) B4 (Beast5) T7 (Mantis6) F3 (Grat9) I8,B1 (Beast2) F4 (Creeps5) T7 (Malboro8) C6 (Q9) I3
cbfe2aa7,210,F3 (Q6) T2 (Beast5) B8 (Glacial9) I7 (Buel1) C4,F1 (Q4) B2 (Ruby5) T7 (Grat6) C3 (Robot9) I8,(Q7) F1 (Robot4) C2 (Jelleye3) I8 (Glacial6) B5 (Unicorn9),(Elnoyle9) F1 (Q2) B4 (Bird7) I8 (Snake5) C6 (Buel3),(Malboro7) F2 (Creeps3) B6 (Q5) T4 (Unicorn1) C9 (Bird8),(Elnoyle9) F4 (Mantis5) I8 (Q2) T1 (Jelleye3) C6 (Grendel7),(Beast9) F1 (Q4) B2 (Grendel5) C6 (Buel3) I8 (Glacial7),(Elnoyle9) T2 (Elastoid3) I6 (Q5) C1 (King7) B8 (Mask4),(Elnoyle9) F1 (Glacial2) B4 (Q5) I6 (Snake7) C8 (Jelleye3),F3 (Giant2) B6 (Grendel5) T4 (Grat7) C1 (Q8) I9
6d59a2bc,211,(Malboro7) C1 (Q4) F2 (Beast3) B6 (Grendel5) I8 (Mask9),(Elnoyle9) C1 (Robot2) B4 (Q5) T7 (Buel6) I3 (Creeps8),(Giant9) C1 (Unicorn4) F2 (Q5) I7 (Malboro3) B6 (Mask8),(Q4) F1 (Ruby2) C3 (Chimera6) I5 (Creeps8) T7 (Grendel9),F1 (Elastoid2) B4 (Beast5) T7 (Q6) C9 (Ruby8) I3,(Elnoyle9) C2 (Beast1) B4 (Q5) I6 (Jelleye3) T7 (Ruby8),(Elnoyle9) B1 (Q2) F4 (Ruby5) C6 (Glacial7) I8 (Jelleye3),(Elnoyle9) B2 (Q1) I6 (Biggs4) T7 (Chimera5) F3 (Buel8),(Elnoyle9) C1 (Q4) F2 (Bird5) B8 (Glacial6) I3 (Grat7),F1 (Bird4) B2 (Beast5) T7 (Creeps6) I8 (Q3) C9
c0c6dc8d,212,F3 (Elastoid6) I9 (Q7) T2 (Snake5) B8 (Mask1) C4,F1 (Q4) B2 (Biggs5) C3 (Creeps6) T7 (Giant9) I8,C5 (Elastoid2) F3 (Bird6) I9 (Q4) B8 (Ruby7) T1,C1 (Creeps4) F2 (Buel5) B3 (Biggs6) T7 (Malboro8) I9,(Biggs9) F1 (Bird2) B4 (Q5) T7 (King6) I3 (Glacial8),(Giant1) F3 (Q2) B6 (Jelleye9) T5 (Snake7) C8 (Glacial4),F3 (Q6) T5 (Grendel4) C2 (Snake7) I8 (Unicorn9) B1,(Giant7) F1 (Q4) B2 (Mantis5) I8 (Beast3) C6 (Mask9),F3 (Q6) T2 (Jelleye5) I8 (Buel1) C9 (Snake4) B7,(Snake9) F3 (Beast6) T2 (Q5) I8 (Mask7) C4 (Bird1)
54fec5ea,213,(Q4) C3 (Beast2) I5 (Unicorn8) T7 (Creeps6) B1 (Grat9),(Chimera7) F3 (Mask2) C6 (Q5) I8 (Glacial9) T4 (Grat1),(Q4) T1 (Grendel7) I8 (Bird9) B6 (Glacial3) F5 (Creeps2),B1 (Elnoyle4) F2 (Q5) T7 (King6) C3 (Buel9) I8,(Biggs9) F3 (Bird6) T2 (Q5) C1 (Grendel4) I7 (Mask8),C1 (Elnoyle2) B4 (Beast5) T7 (Q3) F9 (Glacial8) I6,(Elastoid9) C1 (Giant2) B4 (Grendel5) T7 (Q6) I8 (Malboro3),(Q7) F1 (Mask4) B2 (Creeps5) I8 (Glacial6) C3 (Malboro9),(Elnoyle9) C1 (King2) B4 (Q5) I6 (Jelleye7) F8 (Ruby3),F3 (Elnoyle6) T2 (Giant1) C5 (Mask4) I9 (Beast8) B7
c5fb5e63,214,(Biggs9) C2 (Q5) B8 (Snake4) F7 (Buel1) I6 (Mantis3),(Biggs9) C3 (Grendel2) I6 (Q8) T7 (Bird5) B4 (Chimera1),(Q3) T2 (Giant5) I8 (malboro4) C1 (Grat7) B9 (Mantis6),(Biggs9) C1 (Unicorn4) F2 (Q5) I6 (Beast7) B3 (Bird8),(Chimera1) B4 (Giant5) T7 (Q6) I2 (Mask9) C8 (Glacial3),(Q1) F2 (Creeps5) C3 (Malboro6) I9 (Unicorn8) T7 (Snake4),(Q4) F3 (Jelleye6) T2 (Mantis5) C1 (Beast9) I8 (Mask7),(Q1) F2 (Mask3) T5 (Beast6) B9 (Buel8) I7 (Snake4),(Bird7) F1 (Q2) T4 (Beast5) I8 (Giant6) C3 (Snake9),(Q7) F1 (Creeps4) B2 (Robot3) C5 (Grat6) I9 (Jelleye8)
ac789c48,215,(Elnoyle9) B4 (Q5) T7 (Robot6) F8 (Bird3) I2 (Giant1),T5 (Beast8) B1 (Malboro4) C2 (Giant3) F7 (Biggs6) I9,(elastoid9) B2 (Mantis3) I6 (Q5) T4 (Beast7) C1 (Snake8),F3 (Elastoid6) T2 (Q1) B5 (Beast4) C8 (Glacial7) I9,F1 (Grendel2) B4 (Malboro5) T7 (Q6) C3 (Chimera8) I9,C3 (Q6) T2 (Jelleye5) F8 (Beast7) B9 (King1) I4,F1 (Biggs2) B4 (Unicorn5) T7 (Q8) I9 (Giant3) C6,F2 (Robot5) T4 (Beast7) I8 (Q1) B3 (Grat9) C6,C1 (King2) B4 (Q5) T7 (Creeps6) F3 (Giant9) I8,(Biggs9) B1 (Chimera4) F2 (Creeps5) I7 (Q3) C6 (Unicorn8)
d8cccda9,216,(Q1) F2 (Mask3) B6 (Bird5) C9 (Creeps8) I7 (Glacial4),(Biggs9) B1 (Q4) F2 (Mantis5) C3 (Jelleye6) I8 (Grendel7),(Elastoid9) B3 (Robot2) T1 (Q4) F6 (Unicorn8) I5 (Buel7),C1 (King2) B4 (Q5) T7 (Mask9) F8 (Mantis6) I3,F1 (King2) B4 (Malboro5) T7 (Snake6) C3 (Robot9) I8,F1 (Snake2) B4 (Beast5) T7 (Grendel8) C3 (Q6) I9,C1 (Q4) F2 (Ruby5) B3 (Elastoid6) T7 (Malboro8) I9,F1 (Elnoyle4) B2 (Unicorn5) T7 (Grat6) C3 (Grendel8) I9,C1 (Q4) F2 (Jelleye5) T7 (Grat6) B3 (Malboro8) I9,F1 (King2) B4 (Mask5) T7 (Buel8) C9 (Ruby6) I3
d01b4556,217,C1 (Q4) F2 (Creeps5) B3 (Elastoid6) T7 (Unicorn8) I9,(Elnoyle9) C2 (Mask1) B4 (Robot5) I8 (Q3) T7 (Mantis6),C1 (Q4) F2 (Bird5) T7 (Chimera6) B3 (Glacial8) I9,B1 (Q4) C2 (Elnoyle5) T7 (King8) F3 (Ruby9) I6,F1 (Q4) B2 (Biggs5) T7 (Glacial6) C3 (Creeps9) I8,(Elnoyle9) F1 (King2) B4 (Jelleye5) T7 (Chimera6) C8 (Q3),F1 (Q4) B2 (Glacial5) T7 (Robot6) C3 (Snake9) I8,(Elnoyle9) B1 (Mantis2) F4 (Q5) I6 (King7) C3 (Elastoid8),(Biggs9) F1 (Buel4) B2 (Q5) I6 (Bird7) C3 (Elastoid8),F1 (Beast2) B4 (Q5) T7 (Mantis6) C3 (Grat9) I8
4db1e3df,218,(Elastoid9) F2 (Buel3) I6 (Q4) B5 (Creeps1) T8 (Glacial7),C1 (Jelleye2) B4 (Robot5) T7 (Bird8) I9 (Q3) F6,(Q9) F1 (Creeps4) B2 (Grat5) I8 (Robot3) C6 (Jelleye7),F1 (Q4) B2 (King5) T7 (Grat6) C3 (Glacial8) I9,C1 (Robot4) F2 (Elastoid5) B3 (Ruby6) T7 (Q9) I8,(Biggs9) C2 (Elnoyle3) I6 (Q8) B7 (Grendel1) F5 (Grat4),T2 (Q1) C5 (Giant6) F3 (Biggs4) I9 (Malboro8) B7,B2 (Q5) T4 (Beast7) C1 (Elastoid6) F3 (Grat8) I9,C3 (Grendel2) B6 (Q5) F9 (Snake8) T1 (Mantis7) I4,C1 (Malboro4) F2 (Beast5) T7 (Q8) B3 (Giant6) I9
23e4cc94,219,(Q7) F1 (Giant4) B2 (Mantis5) I8 (King6) C3 (Buel9),(Q7) F1 (Chimera4) B2 (Glacial8) I5 (Robot3) C9 (Grat6),(Q3) F1 (Beast2) B4 (Snake5) T7 (Mantis6) C8 (Malboro9),(Robot7) F1 (Grendel2) T4 (Jelleye9) B5 (Q8) C6 (Buel3),(Q3) F1 (Glacial2) B4 (Mantis5) T7 (Grat8) C9 (Buel6),C1 (Bird4) F2 (Jelleye5) T7 (Unicorn8) B3 (Q6) I9,F1 (Grendel2) B4 (Mantis5) T7 (Q8) I9 (Giant6) C3,(Robot4) F3 (Q2) T1 (Creeps7) B6 (Beast9) C8 (Snake5),(Robot7) F3 (Malboro2) B6 (Q5) I9 (Beast1) T4 (Jelleye8),(Elnoyle9) C1 (Q4) F2 (Giant5) I8 (Snake3) B6 (Creeps7)
292f5685,220,F2 (Beast3) B6 (Chimera5) I9 (Q4) T1 (Jelleye8) C7,(Elastoid9) B1 (Robot4) F2 (Ruby5) I7 (Q3) C6 (Buel8),B1 (Q4) F2 (Beast5) T7 (Ruby6) C3 (Unicorn9) I8,(Elnoyle9) F1 (Malboro2) B4 (King5) T7 (Q8) I6 (Ruby3),F1 (Beast4) B2 (Mask5) C3 (Unicorn6) T7 (Giant8) I9,F1 (Elastoid2) B4 (Elnoyle5) T7 (Q3) C6 (Grendel8) I9,F1 (Elnoyle2) B4 (Chimera5) T7 (Robot6) C3 (Malboro8) I9,(Grendel7) F1 (King2) T4 (Q8) I5 (Grat9) C6 (Snake3),F3 (King6) T2 (Glacial5) C1 (Mantis4) I9 (Q8) B7,F1 (Biggs4) B2 (Jelleye5) T7 (Q6) I8 (Buel3) C9
b8d20982,221,(Q7) F1 (Giant4) C2 (Robot5) I8 (Glacial9) B6 (Chimera3),F1 (Robot4) B2 (Mantis5) I7 (Grendel6) C3 (Chimera8) T9,(Elnoyle9) F1 (Q2) B4 (Mask5) T7 (Unicorn8) I6 (Robot3),(Q3) F1 (Robot2) B4 (Buel5) T7 (Ruby6) C8 (Grat9),(Biggs9) F2 (Malboro1) T6 (Mask5) C3 (Q4) B8 (Snake7),(Giant7) C1 (Q4) F2 (Snake5) B3 (Beast6) I8 (Grendel9),(Q4) F2 (Buel5) T1 (Ruby8) C9 (Bird6) B3 (Snake7),(Elastoid9) F1 (Beast2) B4 (Grendel5) T7 (Q8) I6 (Snake3),(Elnoyle9) F1 (King2) B4 (Grendel5) T7 (Q6) I8 (Snake3),T6 (Beast9) F2 (Q5) C3 (King4) B1 (Giant7) I8
b42f371b,222,F1 (Q4) B2 (Grat5) T7 (Creeps8) I9 (Glacial3) C6,F1 (Unicorn4) B2 (Q5) T7 (Ruby6) C3 (King9) I8,(Glacial9) F1 (Grendel4) B2 (Q5) I7 (Mantis3) T8 (Bird6),F1 (King4) B2 (Creeps5) I7 (Unicorn9) C3 (Q8) T6,(Biggs9) C1 (Snake2) F4 (Q5) I6 (Mask7) B3 (Jelleye8),(Biggs9) B2 (King3) I6 (Mantis8) C5 (Q4) T7 (Buel1),(Q9) F1 (Glacial4) B2 (Mask5) I8 (Giant6) C3 (Chimera7),(Biggs9) F1 (Buel2) B4 (Creeps5) T7 (Q8) C6 (Malboro3),(Elnoyle9) C1 (Chimera2) B4 (Robot5) T7 (Q8) I6 (King3),(Biggs9) T7 (Q4) F2 (Chimera5) I8 (Beast3) B6 (Mantis1)
e6b67fa0,223,(Unicorn7) F3 (Q6) T5 (Giant8) I9 (Robot4) C2 (Mantis1),(Elastoid9) F1 (Robot2) B4 (Mask5) T7 (Q6) I8 (Creeps3),C2 (Glacial3) F6 (Biggs5) T1 (Ruby4) I7 (Elnoyle8) B9,(Biggs9) F2 (Q1) T6 (Elnoyle5) C3 (Bird8) I7 (Grat4),(Q3) F1 (Giant2) B4 (Beast5) T7 (Grendel6) I8 (Mask9),(Elastoid9) B4 (Q7) F2 (Biggs5) I8 (Creeps3) T1 (Bird6),(Q4) F3 (Malboro2) B6 (Mask5) T1 (Giant8) C9 (Mantis7),(Grendel7) F3 (Q6) T5 (Grat8) B9 (Snake4) C2 (Jelleye1),F3 (Beast6) T2 (Q5) C1 (Malboro4) B7 (Giant9) I8,F1 (Snake4) B2 (Beast5) C3 (Biggs6) T7 (Q9) I8
843f5321,224,(Elastoid9) F5 (Q4) B6 (Grat8) T7 (Unicorn3) I2 (Giant1),F3 (Q6) T2 (Elnoyle5) C1 (Beast8) I9 (Mask7) B4,(Beast9) F1 (Buel4) B2 (Q5) T7 (Unicorn6) C3 (Creeps8),(Elnoyle9) F1 (Unicorn2) B4 (Jelleye5) T7 (Glacial6) C8 (Q3),(Giant7) F1 (Beast2) T4 (Chimera8) I5 (Q6) C3 (Creeps9),(Elnoyle9) F4 (Q7) I8 (Mask5) T6 (Jelleye3) C2 (Grat1),(Elastoid9) F1 (Robot2) B4 (Jelleye5) T7 (Glacial6) C8 (Q3),(Elnoyle9) C1 (Q4) T7 (Mantis5) I2 (Ruby6) B8 (Snake3),(Biggs9) B6 (Q5) T4 (Elastoid7) F8 (Snake3) I2 (Giant1),(Elnoyle9) B5 (Chimera8) T7 (Q4) F6 (Mantis3) I2 (Snake1)
710f3e6e,225,(Q1) F3 (King2) B6 (Unicorn5) C9 (Mantis4) I8 (Ruby7),(Elnoyle9) F2 (Robot5) T4 (Q1) I7 (Mask3) B6 (Buel8),(Q1) F3 (Grendel2) B6 (Bird5) C9 (Creeps4) I8 (Mantis7),(Q7) B3 (Jelleye6) T2 (Grendel1) F5 (Robot4) I8 (King9),F1 (Mantis4) B2 (Q5) T7 (Buel9) I8 (Grat6) C3,(Biggs9) F2 (Q1) T6 (Robot5) C3 (Bird8) I7 (Buel4),(Robot7) F1 (Ruby2) T4 (Grat3) B6 (Q5) I8 (Giant9),(Elnoyle9) F2 (Giant3) I6 (Q4) T1 (Buel8) B5 (Malboro7),(Biggs9) F2 (Beast1) T6 (Elastoid5) C3 (Q8) I7 (Chimera4),(Q7) B1 (Chimera2) T4 (Ruby3) I8 (Snake9) C6 (Unicorn5)
8dce9417,226,(Elnoyle9) C1 (Unicorn4) F2 (Beast5) I8 (Bird6) B3 (Q7),(Robot7) B1 (Q2) T4 (Beast3) F9 (Jelleye6) I8 (Glacial5),(Q1) T6 (Mask9) B2 (King5) C3 (Ruby8) I7 (Malboro4),(Jelleye9) F1 (Q2) B4 (Creeps7) I8 (Glacial6) C5 (Grendel3),(Elnoyle9) F1 (Bird2) B4 (King5) T7 (Q8) I6 (Grat3),(Q3) F1 (Mask2) B4 (Unicorn5) T7 (Glacial6) C8 (Grendel9),(Biggs9) F1 (Mask2) B4 (Creeps5) T7 (Q6) I8 (Mantis3),(Biggs9) F1 (Giant2) B4 (Q5) T7 (Mask8) I6 (Creeps3),T6 (Jelleye9) B2 (Q5) C3 (Grat8) I7 (Biggs1) F4,(Q1) F3 (Beast2) B6 (Bird5) C9 (Ruby8) T7 (Buel4)
a008c16c,227,B1 (Q2) F4 (Elastoid5) T7 (Grendel8) C9 (Unicorn6) I3,F2 (Beast3) B6 (Q5) C9 (Grat4) I7 (Creeps1) T8,F3 (Grendel6) T2 (Mask5) C1 (Biggs4) I9 (Q7) B8,(Elastoid9) B1 (Chimera4) T7 (Q5) I6 (Grat2) C3 (Mantis8),F2 (Malboro1) B4 (Jelleye5) T7 (Q3) C9 (Snake8) I6,(Biggs9) F2 (Chimera1) B4 (Snake5) I7 (Q8) C6 (Bird3),F3 (Unicorn6) T2 (Q5) C9 (Ruby7) B8 (Creeps4) I1,F1 (Robot4) B2 (Q5) T7 (Creeps6) C3 (Mantis9) I8,F3 (Biggs6) I9 (Q4) T2 (King5) C1 (Buel8) B7,(Elastoid9) F1 (Buel4) B2 (King5) T7 (Glacial6) C3 (Q8)
5a415f7d,228,F1 (Q4) B2 (Beast5) T7 (Glacial8) C3 (Mask9) I6,C1 (Biggs4) F2 (Q5) B3 (Elnoyle6) T7 (Grat9) I8,C1 (Q4) F2 (Malboro5) B8 (Robot9) T7 (Biggs3) I6,(Elnoyle9) C1 (Bird4) F2 (Grat5) T7 (Q6) B8 (Mask3),(Biggs9) F1 (Ruby2) B4 (Mantis5) T7 (Q6) C3 (Malboro8),(Biggs9) T6 (Q5) C3 (Buel7) F8 (Unicorn4) B2 (Snake1),(Elnoyle9) F1 (Q4) T7 (Glacial5) I2 (Malboro6) B8 (Mask3),(Elnoyle9) F2 (Snake3) I6 (Q4) C5 (Creeps8) T7 (Buel1),F3 (Q2) B6 (Mantis9) T1 (Jelleye4) I8 (Buel5) C7,F1 (Unicorn2) B4 (Q5) T7 (King9) C8 (Grat6) I3
f7afd01a,229,F3 (Biggs2) C5 (Elnoyle6) I9 (Grendel4) T1 (Mask7) B8,B3 (Giant2) F6 (Q5) T4 (Mantis1) C9 (Glacial7) I8,F1 (Buel4) B2 (Elnoyle5) T7 (Q6) I8 (Unicorn3) C9,F1 (Buel4) B2 (Biggs5) T7 (Q6) I8 (Mask3) C9,(Elnoyle9) F1 (Chimera2) B4 (King5) T7 (Q6) I8 (Snake3),(Beast9) F2 (Chimera1) B4 (Q5) C6 (Jelleye8) T7 (Glacial3),(Q7) F1 (Grendel4) I8 (King2) C9 (Glacial3) B6 (Grat5),(Elastoid9) C1 (Ruby2) B4 (Q5) T7 (Mask6) F3 (Glacial8),B3 (Q6) T2 (Mantis5) F9 (Bird4) C1 (Jelleye8) I7,(Elastoid9) F1 (Bird2) B4 (Q5) T7 (Glacial6) I3 (Grendel8)
1574f6d3,230,(Elnoyle9) C1 (Bird2) B4 (Snake5) T7 (Q6) F8 (Robot3),(Q8) F3 (King2) B6 (Grendel5) I9 (Creeps1) C7 (Glacial4),(Biggs9) B1 (Elnoyle2) F4 (Beast5) T7 (Q3) I8 (Ruby6),(Elastoid9) F1 (Q2) B4 (Beast7) I8 (Glacial6) C5 (Jelleye3),(Elastoid9) F2 (Q5) T4 (Grendel7) I8 (Mask3) C1 (King6),(Q4) F3 (Buel6) T2 (Mantis5) C1 (Mask7) I8 (Malboro9),F1 (Mantis4) B2 (Mask5) C3 (Bird6) T7 (King9) I8,(Beast8) C5 (Q4) T7 (Grendel9) B6 (Giant1) I2 (Mask3),(Q9) F1 (Chimera4) B2 (Beast5) I8 (Mantis3) C6 (Buel7),(Elastoid9) F1 (Robot2) B4 (Chimera5) T7 (Q6) I8 (Ruby3)
16055df8,231,F1 (Q4) B2 (Chimera5) C3 (Elastoid6) T7 (Mask9) I8,F2 (Creeps3) B6 (Unicorn5) I9 (Q8) C1 (Jelleye7) T4,(Elastoid9) B4 (Mantis5) F6 (Q2) I8 (jelleye7) T1 (grendel3),F1 (Snake4) B2 (Elastoid5) T7 (Q6) C3 (Buel8) I9,F1 (Elastoid2) B4 (Bird5) T7 (Q3) I8 (Glacial9) C6,(Q4) F2 (Ruby5) B3 (Mantis6) T1 (Robot8) I9 (Bird7),(Elnoyle9) F1 (Giant2) B4 (Q5) T7 (Bird6) I3 (Creeps8),F1 (Biggs2) B4 (Q5) T7 (Creeps6) C3 (Giant9) I8,(Elnoyle9) F4 (Q5) T7 (Creeps6) B8 (Bird2) I1 (Chimera3),(Elastoid9) C1 (Giant4) F2 (Q5) I7 (Grat6) B3 (Grendel8)
4609d799,232,(Q4) F1 (Beast2) B5 (Creeps6) T3 (Giant9) I8 (Grat7),(Q7) F1 (Buel4) B2 (Glacial5) I8 (Snake6) C3 (Giant9),F2 (Beast3) B6 (Q5) T4 (Elastoid1) C9 (Bird7) I8,(Ruby4) B1 (Q2) F5 (Creeps6) I3 (Buel8) C9 (Mantis7),(Q4) F2 (Giant5) T1 (Glacial6) B3 (Mantis7) I8 (Chimera9),(Elastoid9) F4 (Q7) I8 (Mask5) B6 (Buel2) T1 (Creeps3),(Creeps9) F1 (Snake2) B4 (Q5) T7 (Chimera6) C3 (Mask8),(Elnoyle9) F2 (Q5) T4 (Mantis1) I7 (Snake6) C3 (Malboro8),F1 (Elnoyle2) B4 (Creeps5) T7 (Q3) C6 (Malboro9) I8,(Elnoyle9) F2 (Giant3) I6 (Q1) B5 (Creeps8) T7 (Snake4)
6d6d6a86,233,F1 (Biggs4) T7 (Mask2) B5 (Q8) I9 (Glacial6) C3,B1 (Snake2) F4 (Q5) T7 (Creeps8) I9 (Giant3) C6,(Q1) F2 (Mantis3) B6 (Jelleye5) C9 (Buel8) T7 (Snake4),F1 (Q4) B2 (Giant5) C3 (Buel6) T7 (Mask9) I8,(Q1) F2 (Unicorn3) B6 (Malboro5) T9 (Snake4) I8 (Glacial7),(Elastoid9) F1 (Snake2) B4 (King5) I8 (Beast6) C3 (Q7),(Elastoid9) F1 (Grendel2) B4 (Q5) T7 (Ruby6) I3 (Chimera8),(Biggs9) F2 (Bird3) I6 (Q5) T4 (Buel7) C8 (Creeps1),(Robot7) B3 (Chimera6) T5 (Ruby8) F9 (Jelleye4) C1 (Q2),F2 (Unicorn3) B6 (Grendel5) I9 (Creeps4) T1 (Q8) C7
998d1b4f,234,F1 (Biggs2) B4 (Q5) T7 (Malboro6) C3 (Grat9) I8,F2 (Beast3) B6 (Robot5) I9 (Q7) C8 (Grat4) T1,F3 (Beast6) T2 (Elnoyle1) C5 (Malboro4) I8 (Q7) B9,F1 (Malboro2) T4 (Beast5) B8 (Q7) C9 (Unicorn3) I6,C2 (Beast1) B4 (Malboro5) F3 (Elastoid6) T7 (Elnoyle9) I8,F1 (Q4) B2 (Giant5) C3 (Elnoyle6) T7 (Ruby8) I9,F1 (Q2) B4 (Buel5) T7 (Chimera6) C3 (Bird8) I9,B1 (Mask4) F2 (Elastoid5) T7 (Q6) C3 (Unicorn8) I9,F1 (Q2) B4 (Grendel5) T7 (Snake6) C3 (Creeps9) I8,B2 (Q1) T6 (Jelleye5) C3 (Chimera4) F9 (Ruby7) I8
3bb0e144,235,F5 (Q4) T9 (Chimera8) C6 (Elnoyle7) B3 (Snake1) I2,F1 (Elastoid4) B2 (Snake5) C3 (Biggs6) T7 (Malboro9) I8,F1 (Elastoid2) B4 (Ruby5) T7 (Glacial6) I8 (Buel3) C9,F3 (King2) B6 (Q5) I9 (Ruby4) T1 (Grendel7) C8,F1 (Q4) B2 (Chimera5) C3 (Giant6) T7 (King8) I9,(Jelleye9) F1 (Beast4) B2 (Q5) I7 (Creeps6) C3 (Glacial8),F1 (Q4) B2 (Chimera5) T7 (Ruby8) C3 (Robot9) I6,B1 (Elnoyle4) F2 (Biggs5) T7 (Q8) C3 (Grendel9) I6,(Elnoyle9) F3 (Q6) T5 (Biggs4) I2 (Chimera7) C8 (Grat1),B1 (Malboro2) F4 (Beast5) T7 (Q6) I8 (Unicorn9) C3
a958d775,236,F3 (Elastoid6) T2 (Elnoyle5) C1 (Bird4) B7 (Ruby8) I9,F3 (Creeps6) T2 (Biggs5) C1 (Elnoyle4) I7 (Mantis9) B8,F1 (Jelleye4) B2 (Beast5) T7 (Robot8) C3 (Q6) I9,F3 (Grat6) T2 (Elastoid5) C1 (Biggs4) I8 (Q9) B7,F1 (Robot2) B4 (Q5) T7 (Ruby6) C3 (Grat9) I8,B3 (Giant6) T2 (Jelleye5) C1 (Grat4) F7 (Elastoid9) I8,C1 (Q4) F2 (Malboro5) B3 (Beast6) T7 (Grat9) I8,F1 (Glacial4) B2 (Creeps5) C3 (Unicorn6) T7 (Grat9) I8,F1 (Malboro4) B2 (Bird5) C3 (Mantis6) T7 (Giant8) I9,F1 (Q4) B2 (Glacial5) C3 (Buel6) T7 (Unicorn9) I8
f68a79b2,237,F1 (King4) T7 (Q9) B2 (Chimera5) I8 (Malboro3) C6,F1 (Grendel4) T7 (Q5) B2 (Glacial6) C3 (Grat9) I8,F2 (Unicorn3) B6 (Chimera5) I9 (Creeps4) T1 (Snake8) C7,F2 (Grendel3) B6 (Q5) C9 (Elnoyle7) T8 (Mantis4) I1,(Q3) T2 (Beast5) C1 (Creeps4) I9 (Jelleye8) B7 (Chimera6),B3 (Q2) T1 (King4) F6 (Malboro5) C9 (Jelleye8) I7,(Biggs9) B1 (Q2) F4 (Mask7) I8 (Creeps5) C6 (Buel3),(Q1) F3 (Chimera2) B6 (King5) T9 (Grat8) C7 (Glacial4),(Q4) F1 (Mask2) B5 (Malboro8) T7 (Beast6) C3 (Snake9),(Q1) B3 (King2) C6 (Grendel5) F9 (Buel8) T7 (Jelleye4)
eec37d8b,238,(Q1) F3 (Robot2) B6 (King5) C9 (Mantis8) T7 (Grat4),(Elnoyle9) B2 (Robot5) T4 (Q7) C1 (King3) I8 (Unicorn6),(Malboro7) F3 (Giant2) B6 (Q5) C9 (Mantis4) I8 (Grat1),F2 (King5) T4 (Biggs7) C1 (Q8) I9 (Unicorn6) B3,F3 (Q2) B6 (Mask5) T4 (Beast7) C1 (Buel8) I9,F1 (Snake2) B4 (Buel5) T7 (Q6) I8 (Robot3) C9,F2 (Q5) T4 (Chimera7) C1 (Jelleye6) B3 (Elnoyle9) I8,F1 (Q4) B2 (Buel5) T7 (Glacial8) C3 (Grat9) I6,F1 (Elastoid2) B4 (Beast5) T7 (Bird8) I9 (Glacial3) C6,F1 (Mask2) B4 (Q5) T7 (Creeps6) C3 (Grendel9) I8
9d769750,239,(Elastoid9) F6 (Q5) T4 (Malboro7) I8 (Jelleye1) C2 (Creeps3),(Q4) F2 (King5) T1 (Mask3) B6 (Ruby8) C9 (Unicorn7),(Elnoyle9) F1 (Chimera2) B4 (Q5) T7 (Mantis6) I3 (King8),F3 (Bird6) T2 (Q5) C1 (Malboro4) B9 (Unicorn7) I8,(Elnoyle9) T5 (Q8) I7 (Beast4) B6 (Mantis2) F3 (Jelleye1),(Q4) F2 (Robot5) B3 (Glacial6) T1 (Buel9) I8 (Unicorn7),(Elnoyle9) F1 (Q4) B2 (Beast5) I8 (Bird3) C6 (Grat7),(Biggs9) F2 (Q1) T6 (Grendel5) C3 (Glacial8) I7 (Creeps4),(Elastoid9) F2 (King3) I6 (beast5) T1 (Q4) B8 (Glacial7),(Elastoid9) F1 (Q2) B4 (Robot5) T7 (Mask6) C3 (Bird8)
b4f63b11,240,(Biggs9) F1 (Robot2) B4 (Giant5) T7 (Q6) I8 (Bird3),F3 (Beast6) T2 (Q5) C1 (Creeps4) B9 (Bird8) I7,F1 (Q4) B2 (Beast5) T7 (Creeps6) C3 (Giant9) I8,B2 (Elnoyle1) T6 (Elastoid5) C3 (Malboro9) I8 (Q4) F7,F3 (Q2) C6 (Giant5) T1 (Elnoyle4) B9 (Jelleye8) I7,F3 (Biggs2) B6 (Q5) T4 (Malboro7) C1 (Giant8) I9,F2 (Q5) T4 (Beast7) C1 (Mask8) B3 (Chimera9) I6,F1 (Buel4) B2 (Elastoid5) T7 (Q8) C6 (Ruby9) I3,F1 (Beast2) B4 (Q5) T7 (Ruby6) C3 (Buel9) I8,T6 (Biggs9) B2 (Q5) C3 (Mask8) I7 (Unicorn4) F1
a53e299e,241,(Elastoid9) F3 (Mask6) T5 (Malboro4) I2 (Q8) B7 (Giant1),F3 (Elnoyle6) T2 (Biggs1) I9 (Unicorn5) C4 (Q8) B7,(Giant9) F1 (Jelleye4) B2 (Q5) I8 (Beast3) C7 (Bird6),(Elastoid9) F2 (Chimera3) I6 (Q4) T1 (Biggs5) C8 (Unicorn7),F3 (Grendel2) B6 (Bird5) T1 (Jelleye4) I8 (Glacial7) C9,(Q9) F1 (Creeps2) I8 (Giant4) T5 (Bird6) C3 (Mantis7),(Q4) F2 (Glacial5) T1 (Bird3) C6 (Jelleye9) I8 (Mask7),(Biggs9) F2 (Robot3) I6 (Creeps5) B8 (Q4) T1 (Buel7),(Biggs9) F1 (Bird2) B4 (Q5) T7 (Malboro6) I3 (Glacial8),(Creeps9) F1 (Giant2) B4 (Q5) T7 (Snake6) I8 (Bird3)
a4825987,242,T6 (Unicorn9) F2 (Q5) C3 (Giant4) B1 (King7) I8,(Snake9) F1 (Giant2) B4 (Q5) T7 (Chimera8) I6 (Grendel3),F1 (Q4) B2 (Beast5) C3 (Robot6) T7 (Mantis8) I9,B1 (King4) F2 (elastoid5) I7 (Snake6) C3 (Q8) T9,(Elastoid9) F1 (Q2) B4 (Beast5) T7 (Buel8) I6 (Snake3),(Snake9) F1 (Q4) B2 (Mask5) I8 (Ruby6) C3 (Creeps7),(Q6) F1 (King2) I3 (Ruby4) C5 (Beast7) T8 (Grendel9),(Q7) F1 (Creeps2) T4 (Giant3) I8 (Glacial9) C5 (Grat6),F1 (Grendel2) B4 (Mask5) T7 (Q6) C3 (King8) I9,(Elnoyle9) F1 (King2) B4 (Q5) T7 (Robot6) I3 (Grendel8)
b4748c1c,243,(Q7) F2 (Robot3) B5 (Glacial6) I8 (Mantis1) C4 (Buel9),(Q1) F2 (Glacial3) B5 (King6) I9 (Beast4) C8 (Jelleye7),F1 (Mask4) B2 (Malboro5) T7 (Q6) C3 (Bird8) I9,(Robot4) F3 (Q2) T1 (King7) I8 (Chimera9) C5 (Grendel6),F3 (Malboro2) B6 (Q5) T4 (Chimera7) C1 (Biggs9) I8,F1 (Malboro4) B2 (Biggs5) C3 (Snake6) T8 (Chimera9) I7,F2 (Mask1) B4 (King5) C3 (Elastoid6) T7 (Elnoyle8) I9,(Biggs9) F3 (Q6) T5 (Malboro4) I2 (Unicorn8) B7 (Grendel1),(Q4) F3 (Jelleye6) T2 (King5) C1 (Bird8) B9 (Snake7),(Biggs9) B1 (Jelleye4) T7 (Giant5) C2 (Mask6) I8 (Q3)
f88d9e6d,244,(Buel9) F1 (Q4) B2 (Grat5) C3 (Ruby8) T7 (Grendel6),(Biggs9) F1 (Robot4) B2 (Q5) C3 (King6) I7 (Mask8),(Q7) F1 (Grendel2) T4 (Mantis8) B5 (Buel9) C6 (Grat3),F1 (Q4) B2 (Malboro5) C3 (Mantis6) T7 (Glacial9) I8,(Bird9) F2 (Giant1) T6 (King3) C5 (Buel4) I8 (Q7),(Unicorn7) F2 (Q1) T6 (Ruby9) I8 (Grendel3) C5 (Snake4),(Biggs9) C1 (Beast2) F4 (Mantis5) T7 (Q6) B8 (Chimera3),F2 (Glacial3) B6 (Q5) C9 (Unicorn4) I1 (Grat7) T8,(Elastoid9) F3 (Beast2) I6 (Q1) B5 (Mask4) C8 (Creeps7),(Snake9) F2 (Q1) T6 (Creeps5) C3 (Mantis8) I7 (Robot4)
d8e0664a,245,F1 (Robot2) B4 (Chimera5) T7 (Q6) C3 (Giant8) I9,F2 (Chimera1) B4 (Q5) T7 (Grendel8) I9 (King3) C6,F2 (Chimera3) B6 (Q5) I9 (Robot7) C8 (Unicorn1) T4,F1 (Ruby4) B2 (Glacial5) T7 (Q3) C6 (Mask9) I8,F1 (Q4) B2 (Grendel5) C3 (Elastoid6) T7 (King9) I8,T6 (Q9) I8 (King1) B2 (Grat5) C3 (Bird7) F4,(Elastoid9) T2 (Giant1) B5 (Robot4) I7 (Glacial6) C8 (Q3),F1 (Elnoyle4) B2 (King5) T7 (Q6) C3 (Malboro8) I9,B1 (Elnoyle2) F4 (Mask5) T7 (Q6) C3 (Creeps8) I9,B1 (Elastoid4) F2 (Elnoyle5) T7 (Q6) C3 (Mantis8) I9
772dab43,246,F1 (Q4) B2 (Unicorn5) T7 (Creeps8) C9 (Snake6) I3,T6 (Chimera9) F2 (Q5) C3 (Bird4) B1 (Beast8) I7,(Bird7) F2 (Chimera3) B6 (Q5) I4 (Ruby9) T8 (Mask1),(Q4) F3 (Malboro2) B6 (Giant5) T1 (Unicorn9) I8 (Glacial7),(Elnoyle9) B6 (Q5) T4 (Elastoid7) F8 (King1) I2 (Chimera3),(Elastoid9) F1 (Bird2) B4 (Buel5) T7 (Q8) C6 (Glacial3),(Elnoyle9) C1 (Bird4) T7 (Snake5) I2 (Q6) B8 (Ruby3),(King7) F2 (jelleye3) B6 (Q5) I8 (Malboro1) C9 (Glacial4),(Q6) F1 (Beast2) B4 (King5) T7 (Creeps3) I8 (Buel9),F3 (Q2) B6 (Elnoyle9) T5 (Bird4) C8 (Snake7) I1
